id	depth	sentence	fol	folpol	vf	vfpol	tags	drs
37	3	elliot kicked every bear that a fox that followed every horse that did not lick a tiger touched	exists x1.(elliot(x1) & all x2.((bear(x2) & exists x3.(fox(x3) & all x4.((horse(x4) & -exists x5.(tiger(x5) & lick(x5,x4))) -> follow(x4,x3)) & touch(x3,x2))) -> kick(x1,x2)))	[('elliot', 1), ('bear', 0), ('fox', 0), ('horse', 1), ('tiger', 0), ('lick', 0), ('follow', 0), ('touch', 0), ('kick', 1)]	EXIST ELLIOT ALL AND BEAR EXIST AND FOX ALL AND HORSE NOT EXIST TIGER LICK FOLLOW INV TOUCH KICK	[[elliot,pos],[bear,neg],[fox,neg],[horse,pos],[tiger,neg],[lick,neg],[follow,neg],[touch,neg],[kick,pos]]	sbj_quant:no;obj_quant:yes;negation:yes;adjective:no;peripheral:yes;center:yes;adverb:no;conjunction:no;disjunction:no	b1 REF x1 [SEP] b1 elliot x1 [SEP] b1 IMP b2 b3 [SEP] b2 REF x2 [SEP] b2 REF x3 [SEP] b2 bear x2 [SEP] b2 fox x3 [SEP] b2 IMP b3 b4 [SEP] b3 REF x4 [SEP] b3 horse x4 [SEP] b3 NOT b4 [SEP] b4 REF x5 [SEP] b4 tiger x5 [SEP] b4 lick x5 x4 [SEP] b4 follow x4 x3 [SEP] b2 touch x3 x2 [SEP] b3 kick x1 x2
38	3	greg did not like all cats that three monkeys that kissed three horses that did not lick all foxes did not kiss	exists x1.(greg(x1) & -all x2.((cat(x2) & exists x3.(three(x3) & monkey(x3) & exists x4.(three(x4) & horse(x4) & -all x5.(fox(x5) -> lick(x5,x4)) & kiss(x4,x3)) & -kiss(x3,x2))) -> like(x1,x2)))	[('greg', 1), ('cat', 1), ('three', 1), ('monkey', 1), ('three', 1), ('horse', 1), ('fox', 1), ('lick', 0), ('kiss', 1), ('kiss', 0), ('like', 0)]	EXIST GREG NOT ALL AND CAT THREE AND MONKEY THREE AND HORSE NOT ALL FOX LICK KISS NOT INV KISS LIKE	[[greg,pos],[cat,pos],[monkey,pos],[horse,pos],[fox,pos],[lick,neg],[kiss,pos],[kiss,neg],[like,neg]]	sbj_quant:no;obj_quant:yes;negation:yes;adjective:no;peripheral:yes;center:yes;adverb:no;conjunction:no;disjunction:no	b1 REF x1 [SEP] b1 greg x1 [SEP] b1 NOT b2 [SEP] b2 IMP b3 b4 [SEP] b3 REF x2 [SEP] b3 REF x3 [SEP] b3 REF x4 [SEP] b3 cat x2 [SEP] b3 three x3 [SEP] b3 monkey x3 [SEP] b3 three x4 [SEP] b3 horse x4 [SEP] b3 NOT b4 [SEP] b4 IMP b5 b6 [SEP] b5 REF x5 [SEP] b5 fox x5 [SEP] b6 lick x5 x4 [SEP] b3 kiss x4 x3 [SEP] b3 NOT b4 [SEP] b4 kiss x3 x2 [SEP] b4 like x1 x2
39	3	two foxes that two monkeys that one lion that three small rabbits cleaned kissed did not like did not love greg	exists x1.(two(x1) & fox(x1) & exists x2.(two(x2) & monkey(x2) & exists x3.(lion(x3) & exists x4.(three(x4) & rabbit(x4) & small(x4) & clean(x4,x3)) & kiss(x3,x2)) & -like(x2,x1)) & -exists x5.(greg(x5) & love(x1,x5)))	[('two', 1), ('fox', 1), ('two', 1), ('monkey', 1), ('lion', 1), ('three', 1), ('rabbit', 1), ('small', 1), ('clean', 1), ('kiss', 1), ('like', 0), ('greg', 0), ('love', 0)]	TWO AND FOX TWO AND MONKEY EXIST AND LION THREE AND RABBIT SMALL INV CLEAN INV KISS NOT INV LIKE NOT EXIST GREG LOVE	[[fox,pos],[monkey,pos],[lion,pos],[rabbit,pos],[small,pos],[clean,pos],[kiss,pos],[like,neg],[greg,neg],[love,neg]]	sbj_quant:yes;obj_quant:no;negation:yes;adjective:yes;peripheral:no;center:yes;adverb:no;conjunction:no;disjunction:no	b1 REF x1 [SEP] b1 REF x2 [SEP] b1 REF x3 [SEP] b1 REF x4 [SEP] b1 two x1 [SEP] b1 fox x1 [SEP] b1 two x2 [SEP] b1 monkey x2 [SEP] b1 lion x3 [SEP] b1 three x4 [SEP] b1 rabbit x4 [SEP] b1 small x4 [SEP] b1 clean x4 x3 [SEP] b1 kiss x3 x2 [SEP] b1 NOT b2 [SEP] b2 like x2 x1 [SEP] b1 NOT b2 [SEP] b2 REF x5 [SEP] b2 greg x5 [SEP] b2 love x1 x5
40	3	one horse that every bird that licked every monkey that a wild rabbit followed liked did not cry quickly	exists x1.(horse(x1) & all x2.((bird(x2) & all x3.((monkey(x3) & exists x4.(rabbit(x4) & wild(x4) & follow(x4,x3))) -> lick(x3,x2))) -> like(x2,x1)) & -(cry(x1) & quickly(x1)))	[('horse', 1), ('bird', 0), ('monkey', 1), ('rabbit', 1), ('wild', 1), ('follow', 1), ('lick', 0), ('like', 1), ('cry', 0), ('quickly', 0)]	EXIST AND HORSE ALL AND BIRD ALL AND MONKEY EXIST AND RABBIT WILD INV FOLLOW LICK INV LIKE NOT AND CRY QUICKLY	[[horse,pos],[bird,neg],[monkey,pos],[rabbit,pos],[wild,pos],[follow,pos],[lick,neg],[like,pos],[cry,neg],[quickly,neg]]	sbj_quant:yes;obj_quant:no;negation:yes;adjective:yes;peripheral:yes;center:yes;adverb:yes;conjunction:no;disjunction:no	b1 REF x1 [SEP] b1 horse x1 [SEP] b1 IMP b2 b3 [SEP] b2 REF x2 [SEP] b2 bird x2 [SEP] b2 IMP b3 b4 [SEP] b3 REF x3 [SEP] b3 REF x4 [SEP] b3 monkey x3 [SEP] b3 rabbit x4 [SEP] b3 wild x4 [SEP] b3 follow x4 x3 [SEP] b4 lick x3 x2 [SEP] b3 like x2 x1 [SEP] b1 NOT b2 [SEP] b2 cry x1 [SEP] b2 quickly x1
41	4	every fox that accepted a bear that one dog that one monkey that a cat did not clean did not touch did not kick did not come	all x1.((fox(x1) & exists x2.(bear(x2) & exists x3.(dog(x3) & exists x4.(monkey(x4) & exists x5.(cat(x5) & -clean(x5,x4)) & -touch(x4,x3)) & -kick(x3,x2)) & accept(x2,x1))) -> -come(x1))	[('fox', 0), ('bear', 0), ('dog', 0), ('monkey', 0), ('cat', 0), ('clean', 1), ('touch', 1), ('kick', 1), ('accept', 0), ('come', 0)]	ALL AND FOX EXIST AND BEAR EXIST AND DOG EXIST AND MONKEY EXIST CAT NOT INV CLEAN NOT INV TOUCH NOT INV KICK ACCEPT NOT COME	[[fox,neg],[bear,neg],[dog,neg],[monkey,neg],[cat,neg],[clean,pos],[touch,pos],[kick,pos],[accept,neg],[come,neg]]	sbj_quant:yes;obj_quant:no;negation:yes;adjective:no;peripheral:yes;center:yes;adverb:no;conjunction:no;disjunction:no	b1 IMP b2 b3 [SEP] b2 REF x1 [SEP] b2 REF x2 [SEP] b2 REF x3 [SEP] b2 REF x4 [SEP] b2 REF x5 [SEP] b2 fox x1 [SEP] b2 bear x2 [SEP] b2 dog x3 [SEP] b2 monkey x4 [SEP] b2 cat x5 [SEP] b2 NOT b3 [SEP] b3 clean x5 x4 [SEP] b2 NOT b3 [SEP] b3 touch x4 x3 [SEP] b2 NOT b3 [SEP] b3 kick x3 x2 [SEP] b2 accept x2 x1 [SEP] b3 NOT b4 [SEP] b4 come x1
42	4	john did not like three birds that did not kiss all lions that did not lick all rabbits that did not kick two bears that liked all crazy tigers	exists x1.(john(x1) & -exists x2.(three(x2) & bird(x2) & -all x3.((lion(x3) & -all x4.((rabbit(x4) & -exists x5.(two(x5) & bear(x5) & all x6.((tiger(x6) & crazy(x6)) -> like(x6,x5)) & kick(x5,x4))) -> lick(x4,x3))) -> kiss(x3,x2)) & like(x1,x2)))	[('john', 1), ('three', 0), ('bird', 0), ('lion', 0), ('rabbit', 0), ('two', 1), ('bear', 1), ('tiger', 0), ('crazy', 0), ('like', 1), ('kick', 1), ('lick', 1), ('kiss', 1), ('like', 0)]	EXIST JOHN NOT THREE AND BIRD NOT ALL AND LION NOT ALL AND RABBIT NOT TWO AND BEAR ALL AND TIGER CRAZY LIKE KICK LICK KISS LIKE	[[john,pos],[bird,neg],[lion,neg],[rabbit,neg],[bear,pos],[tiger,neg],[crazy,neg],[like,pos],[kick,pos],[lick,pos],[kiss,pos],[like,neg]]	sbj_quant:no;obj_quant:yes;negation:yes;adjective:yes;peripheral:yes;center:no;adverb:no;conjunction:no;disjunction:no	b1 REF x1 [SEP] b1 john x1 [SEP] b1 NOT b2 [SEP] b2 REF x2 [SEP] b2 three x2 [SEP] b2 bird x2 [SEP] b2 NOT b3 [SEP] b3 IMP b4 b5 [SEP] b4 REF x3 [SEP] b4 lion x3 [SEP] b4 NOT b5 [SEP] b5 IMP b6 b7 [SEP] b6 REF x4 [SEP] b6 rabbit x4 [SEP] b6 NOT b7 [SEP] b7 REF x5 [SEP] b7 two x5 [SEP] b7 bear x5 [SEP] b7 IMP b8 b9 [SEP] b8 REF x6 [SEP] b8 tiger x6 [SEP] b8 crazy x6 [SEP] b9 like x6 x5 [SEP] b7 kick x5 x4 [SEP] b7 lick x4 x3 [SEP] b5 kiss x3 x2 [SEP] b2 like x1 x2
43	4	one horse that a bird that one fox that did not clean every rabbit that every large tiger did not follow did not love followed did not escape	exists x1.(horse(x1) & exists x2.(bird(x2) & exists x3.(fox(x3) & -all x4.((rabbit(x4) & all x5.((tiger(x5) & large(x5)) -> -follow(x5,x4))) -> clean(x4,x3)) & -love(x3,x2)) & follow(x2,x1)) & -escape(x1))	[('horse', 1), ('bird', 1), ('fox', 1), ('rabbit', 1), ('tiger', 0), ('large', 0), ('follow', 0), ('clean', 0), ('love', 0), ('follow', 1), ('escape', 0)]	EXIST AND HORSE EXIST AND BIRD EXIST AND FOX NOT ALL AND RABBIT ALL AND TIGER LARGE NOT INV FOLLOW CLEAN NOT INV LOVE INV FOLLOW NOT ESCAPE	[[horse,pos],[bird,pos],[fox,pos],[rabbit,pos],[tiger,neg],[large,neg],[follow,neg],[clean,neg],[love,neg],[follow,pos],[escape,neg]]	sbj_quant:yes;obj_quant:no;negation:yes;adjective:yes;peripheral:yes;center:yes;adverb:no;conjunction:no;disjunction:no	b1 REF x1 [SEP] b1 REF x2 [SEP] b1 REF x3 [SEP] b1 horse x1 [SEP] b1 bird x2 [SEP] b1 fox x3 [SEP] b1 NOT b2 [SEP] b2 IMP b3 b4 [SEP] b3 REF x4 [SEP] b3 rabbit x4 [SEP] b3 IMP b4 b5 [SEP] b4 REF x5 [SEP] b4 tiger x5 [SEP] b4 large x5 [SEP] b5 NOT b6 [SEP] b6 follow x5 x4 [SEP] b4 clean x4 x3 [SEP] b1 NOT b2 [SEP] b2 love x3 x2 [SEP] b1 follow x2 x1 [SEP] b1 NOT b2 [SEP] b2 escape x1
44	4	bob accepted a fox that one rabbit that kicked every tiger that did not clean one cat that a horse licked followed	exists x1.(bob(x1) & exists x2.(fox(x2) & exists x3.(rabbit(x3) & all x4.((tiger(x4) & -exists x5.(cat(x5) & exists x6.(horse(x6) & lick(x6,x5)) & clean(x5,x4))) -> kick(x4,x3)) & follow(x3,x2)) & accept(x1,x2)))	[('bob', 1), ('fox', 1), ('rabbit', 1), ('tiger', 0), ('cat', 1), ('horse', 1), ('lick', 1), ('clean', 1), ('kick', 1), ('follow', 1), ('accept', 1)]	EXIST BOB EXIST AND FOX EXIST AND RABBIT ALL AND TIGER NOT EXIST AND CAT EXIST HORSE INV LICK CLEAN KICK INV FOLLOW ACCEPT	[[bob,pos],[fox,pos],[rabbit,pos],[tiger,neg],[cat,pos],[horse,pos],[lick,pos],[clean,pos],[kick,pos],[follow,pos],[accept,pos]]	sbj_quant:no;obj_quant:yes;negation:yes;adjective:no;peripheral:yes;center:yes;adverb:no;conjunction:no;disjunction:no	b1 REF x1 [SEP] b1 REF x2 [SEP] b1 REF x3 [SEP] b1 bob x1 [SEP] b1 fox x2 [SEP] b1 rabbit x3 [SEP] b1 IMP b2 b3 [SEP] b2 REF x4 [SEP] b2 tiger x4 [SEP] b2 NOT b3 [SEP] b3 REF x5 [SEP] b3 REF x6 [SEP] b3 cat x5 [SEP] b3 horse x6 [SEP] b3 lick x6 x5 [SEP] b3 clean x5 x4 [SEP] b3 kick x4 x3 [SEP] b1 follow x3 x2 [SEP] b1 accept x1 x2
45	4	one lion that chased every monkey that kicked every fox that every rabbit that every crazy bird touched did not clean did not swim	exists x1.(lion(x1) & all x2.((monkey(x2) & all x3.((fox(x3) & all x4.((rabbit(x4) & all x5.((bird(x5) & crazy(x5)) -> touch(x5,x4))) -> -clean(x4,x3))) -> kick(x3,x2))) -> chase(x2,x1)) & -swim(x1))	[('lion', 1), ('monkey', 0), ('fox', 1), ('rabbit', 0), ('bird', 1), ('crazy', 1), ('touch', 0), ('clean', 0), ('kick', 0), ('chase', 1), ('swim', 0)]	EXIST AND LION ALL AND MONKEY ALL AND FOX ALL AND RABBIT ALL AND BIRD CRAZY INV TOUCH NOT INV CLEAN KICK CHASE NOT SWIM	[[lion,pos],[monkey,neg],[fox,pos],[rabbit,neg],[bird,pos],[crazy,pos],[touch,neg],[clean,neg],[kick,neg],[chase,pos],[swim,neg]]	sbj_quant:yes;obj_quant:no;negation:yes;adjective:yes;peripheral:yes;center:yes;adverb:no;conjunction:no;disjunction:no	b1 REF x1 [SEP] b1 lion x1 [SEP] b1 IMP b2 b3 [SEP] b2 REF x2 [SEP] b2 monkey x2 [SEP] b2 IMP b3 b4 [SEP] b3 REF x3 [SEP] b3 fox x3 [SEP] b3 IMP b4 b5 [SEP] b4 REF x4 [SEP] b4 rabbit x4 [SEP] b4 IMP b5 b6 [SEP] b5 REF x5 [SEP] b5 bird x5 [SEP] b5 crazy x5 [SEP] b6 touch x5 x4 [SEP] b5 NOT b6 [SEP] b6 clean x4 x3 [SEP] b4 kick x3 x2 [SEP] b3 chase x2 x1 [SEP] b1 NOT b2 [SEP] b2 swim x1
46	4	two lions that did not kiss a bear that accepted all dogs that did not like three cats that cried lazily did not run seriously	exists x1.(two(x1) & lion(x1) & -exists x2.(bear(x2) & all x3.((dog(x3) & -exists x4.(three(x4) & cat(x4) & cry(x4) & lazily(x4) & like(x4,x3))) -> accept(x3,x2)) & kiss(x2,x1)) & -(run(x1) & seriously(x1)))	[('two', 1), ('lion', 1), ('bear', 0), ('dog', 1), ('three', 0), ('cat', 0), ('cry', 0), ('lazily', 0), ('like', 0), ('accept', 0), ('kiss', 0), ('run', 0), ('seriously', 0)]	TWO AND LION NOT EXIST AND BEAR ALL AND DOG NOT THREE AND CAT AND CRY LAZILY LIKE ACCEPT KISS NOT AND RUN SERIOUSLY	[[lion,pos],[bear,neg],[dog,pos],[cat,neg],[cry,neg],[lazily,neg],[like,neg],[accept,neg],[kiss,neg],[run,neg],[seriously,neg]]	sbj_quant:yes;obj_quant:no;negation:yes;adjective:no;peripheral:yes;center:no;adverb:yes;conjunction:no;disjunction:no	b1 REF x1 [SEP] b1 two x1 [SEP] b1 lion x1 [SEP] b1 NOT b2 [SEP] b2 REF x2 [SEP] b2 bear x2 [SEP] b2 IMP b3 b4 [SEP] b3 REF x3 [SEP] b3 dog x3 [SEP] b3 NOT b4 [SEP] b4 REF x4 [SEP] b4 three x4 [SEP] b4 cat x4 [SEP] b4 cry x4 [SEP] b4 lazily x4 [SEP] b4 like x4 x3 [SEP] b4 accept x3 x2 [SEP] b2 kiss x2 x1 [SEP] b1 NOT b2 [SEP] b2 run x1 [SEP] b2 seriously x1
47	4	a bird that liked every tiger that one fox that a horse that a bear did not lick did not follow did not kiss did not escape	exists x1.(bird(x1) & all x2.((tiger(x2) & exists x3.(fox(x3) & exists x4.(horse(x4) & exists x5.(bear(x5) & -lick(x5,x4)) & -follow(x4,x3)) & -kiss(x3,x2))) -> like(x2,x1)) & -escape(x1))	[('bird', 1), ('tiger', 0), ('fox', 0), ('horse', 0), ('bear', 0), ('lick', 1), ('follow', 1), ('kiss', 1), ('like', 1), ('escape', 0)]	EXIST AND BIRD ALL AND TIGER EXIST AND FOX EXIST AND HORSE EXIST BEAR NOT INV LICK NOT INV FOLLOW NOT INV KISS LIKE NOT ESCAPE	[[bird,pos],[tiger,neg],[fox,neg],[horse,neg],[bear,neg],[lick,pos],[follow,pos],[kiss,pos],[like,pos],[escape,neg]]	sbj_quant:yes;obj_quant:no;negation:yes;adjective:no;peripheral:yes;center:yes;adverb:no;conjunction:no;disjunction:no	b1 REF x1 [SEP] b1 bird x1 [SEP] b1 IMP b2 b3 [SEP] b2 REF x2 [SEP] b2 REF x3 [SEP] b2 REF x4 [SEP] b2 REF x5 [SEP] b2 tiger x2 [SEP] b2 fox x3 [SEP] b2 horse x4 [SEP] b2 bear x5 [SEP] b2 NOT b3 [SEP] b3 lick x5 x4 [SEP] b2 NOT b3 [SEP] b3 follow x4 x3 [SEP] b2 NOT b3 [SEP] b3 kiss x3 x2 [SEP] b3 like x2 x1 [SEP] b1 NOT b2 [SEP] b2 escape x1
48	4	elliot accepted one monkey that every fox that touched one lion that did not accept one tiger that every dog loved liked	exists x1.(elliot(x1) & exists x2.(monkey(x2) & all x3.((fox(x3) & exists x4.(lion(x4) & -exists x5.(tiger(x5) & all x6.(dog(x6) -> love(x6,x5)) & accept(x5,x4)) & touch(x4,x3))) -> like(x3,x2)) & accept(x1,x2)))	[('elliot', 1), ('monkey', 1), ('fox', 0), ('lion', 0), ('tiger', 1), ('dog', 0), ('love', 1), ('accept', 1), ('touch', 0), ('like', 1), ('accept', 1)]	EXIST ELLIOT EXIST AND MONKEY ALL AND FOX EXIST AND LION NOT EXIST AND TIGER ALL DOG INV LOVE ACCEPT TOUCH INV LIKE ACCEPT	[[elliot,pos],[monkey,pos],[fox,neg],[lion,neg],[tiger,pos],[dog,neg],[love,pos],[accept,pos],[touch,neg],[like,pos],[accept,pos]]	sbj_quant:no;obj_quant:yes;negation:yes;adjective:no;peripheral:yes;center:yes;adverb:no;conjunction:no;disjunction:no	b1 REF x1 [SEP] b1 REF x2 [SEP] b1 elliot x1 [SEP] b1 monkey x2 [SEP] b1 IMP b2 b3 [SEP] b2 REF x3 [SEP] b2 REF x4 [SEP] b2 fox x3 [SEP] b2 lion x4 [SEP] b2 NOT b3 [SEP] b3 REF x5 [SEP] b3 tiger x5 [SEP] b3 IMP b4 b5 [SEP] b4 REF x6 [SEP] b4 dog x6 [SEP] b5 love x6 x5 [SEP] b3 accept x5 x4 [SEP] b2 touch x4 x3 [SEP] b3 like x3 x2 [SEP] b1 accept x1 x2
49	4	a monkey that two bears that three monkeys that all rabbits that liked two polite lions accepted touched kicked did not rush and come	exists x1.(monkey(x1) & exists x2.(two(x2) & bear(x2) & exists x3.(three(x3) & monkey(x3) & all x4.((rabbit(x4) & exists x5.(two(x5) & lion(x5) & polite(x5) & like(x5,x4))) -> accept(x4,x3)) & touch(x3,x2)) & kick(x2,x1)) & -(rush(x1) & come(x1)))	[('monkey', 1), ('two', 1), ('bear', 1), ('three', 1), ('monkey', 1), ('rabbit', 0), ('two', 0), ('lion', 0), ('polite', 0), ('like', 0), ('accept', 1), ('touch', 1), ('kick', 1), ('rush', 0), ('come', 0)]	EXIST AND MONKEY TWO AND BEAR THREE AND MONKEY ALL AND RABBIT TWO AND LION POLITE LIKE INV ACCEPT INV TOUCH INV KICK NOT AND RUSH COME	[[monkey,pos],[bear,pos],[monkey,pos],[rabbit,neg],[lion,neg],[polite,neg],[like,neg],[accept,pos],[touch,pos],[kick,pos],[rush,neg],[come,neg]]	sbj_quant:yes;obj_quant:no;negation:yes;adjective:yes;peripheral:yes;center:yes;adverb:no;conjunction:yes;disjunction:no	b1 REF x1 [SEP] b1 REF x2 [SEP] b1 REF x3 [SEP] b1 monkey x1 [SEP] b1 two x2 [SEP] b1 bear x2 [SEP] b1 three x3 [SEP] b1 monkey x3 [SEP] b1 IMP b2 b3 [SEP] b2 REF x4 [SEP] b2 REF x5 [SEP] b2 rabbit x4 [SEP] b2 two x5 [SEP] b2 lion x5 [SEP] b2 polite x5 [SEP] b2 like x5 x4 [SEP] b3 accept x4 x3 [SEP] b1 touch x3 x2 [SEP] b1 kick x2 x1 [SEP] b1 NOT b2 [SEP] b2 rush x1 [SEP] b2 come x1
50	4	every monkey that a lion that a cat that every dog that one small rabbit followed accepted liked touched kissed tom	all x1.((monkey(x1) & exists x2.(lion(x2) & exists x3.(cat(x3) & all x4.((dog(x4) & exists x5.(rabbit(x5) & small(x5) & follow(x5,x4))) -> accept(x4,x3)) & like(x3,x2)) & touch(x2,x1))) -> exists x6.(tom(x6) & kiss(x1,x6)))	[('monkey', 0), ('lion', 0), ('cat', 0), ('dog', 1), ('rabbit', 1), ('small', 1), ('follow', 1), ('accept', 0), ('like', 0), ('touch', 0), ('tom', 1), ('kiss', 1)]	ALL AND MONKEY EXIST AND LION EXIST AND CAT ALL AND DOG EXIST AND RABBIT SMALL INV FOLLOW INV ACCEPT INV LIKE INV TOUCH EXIST TOM KISS	[[monkey,neg],[lion,neg],[cat,neg],[dog,pos],[rabbit,pos],[small,pos],[follow,pos],[accept,neg],[like,neg],[touch,neg],[tom,pos],[kiss,pos]]	sbj_quant:yes;obj_quant:no;negation:no;adjective:yes;peripheral:no;center:yes;adverb:no;conjunction:no;disjunction:no	b1 IMP b2 b3 [SEP] b2 REF x1 [SEP] b2 REF x2 [SEP] b2 REF x3 [SEP] b2 monkey x1 [SEP] b2 lion x2 [SEP] b2 cat x3 [SEP] b2 IMP b3 b4 [SEP] b3 REF x4 [SEP] b3 REF x5 [SEP] b3 dog x4 [SEP] b3 rabbit x5 [SEP] b3 small x5 [SEP] b3 follow x5 x4 [SEP] b4 accept x4 x3 [SEP] b2 like x3 x2 [SEP] b2 touch x2 x1 [SEP] b3 REF x6 [SEP] b3 tom x6 [SEP] b3 kiss x1 x6
